{
  "schemaVersion": "1.0",
  "id": "00000000-0000-4000-8000-000000000001",
  "name": "Sample – Online Banking",
  "description": "Sample diagram created automatically",
  "owner": "system",
  "createdAt": "2026-10-04T00:00:00Z",
  "updatedAt": "2026-10-04T00:00:00Z",
  "settings": {
    "background": "dots",
    "defaultTimeframe": {
      "from": "now()-2h",
      "to": "now()"
    },
    "refreshInterval": "off"
  },
  "nodes": [
    {
      "id": "n1",
      "type": "entityNode",
      "position": {
        "x": 0,
        "y": 140
      },
      "data": {
        "kind": "entity",
        "componentType": "frontend",
        "name": "Web Banking",
        "entities": [],
        "entityDql": "smartscapeNodes \"FRONTEND\"\n| fields id, id_classic, name\n| limit 1",
        "icon": "ApplicationsIcon",
        "failPoint": {
          "warningMin": 1,
          "failingMin": 3
        }
      }
    },
    {
      "id": "n2",
      "type": "entityNode",
      "position": {
        "x": 380,
        "y": 0
      },
      "data": {
        "kind": "entity",
        "componentType": "service",
        "name": "Accounts API",
        "entities": [],
        "entityDql": "smartscapeNodes \"SERVICE\"\n| filter contains(name, \"account\", caseSensitive: false)\n| fields id, name",
        "icon": "ServicesIcon",
        "failPoint": {
          "problemMatch": "event.category == \"ERROR\"",
          "warningMin": 1,
          "failingMin": 2
        },
        "kpi": {
          "enabled": true,
          "title": "Signals",
          "items": [
            {
              "id": "k1",
              "dql": "timeseries rt = avg(dt.service.request.response_time, scalar: true), by: {dt.smartscape.service}\n| fieldsAdd service = getNodeName(dt.smartscape.service), avg_ms = rt / 1000\n| fields service, avg_ms\n| sort avg_ms desc\n| limit 5",
              "valueField": "avg_ms",
              "labelMode": "column",
              "labelField": "service",
              "unit": "ms",
              "decimals": 1,
              "maxRows": 3
            }
          ]
        }
      }
    },
    {
      "id": "n3",
      "type": "entityNode",
      "position": {
        "x": 380,
        "y": 300
      },
      "data": {
        "kind": "entity",
        "componentType": "service",
        "name": "Payments API",
        "entities": [],
        "entityDql": "smartscapeNodes \"SERVICE\"\n| filter contains(name, \"payment\", caseSensitive: false)\n| fields id, name",
        "icon": "ServicesIcon",
        "failPoint": {
          "warningMin": 1,
          "failingMin": 1
        }
      }
    },
    {
      "id": "n4",
      "type": "customNode",
      "position": {
        "x": 780,
        "y": 100
      },
      "size": {
        "w": 280,
        "h": 200
      },
      "data": {
        "kind": "custom",
        "icon": "DatabaseIcon",
        "name": "Databases",
        "mode": "entities",
        "entities": {
          "dql": "smartscapeNodes \"DB_INSTANCE_*\"\n| fields id, name\n| limit 5",
          "subNameField": "name",
          "criterion": "anyProblem"
        },
        "maxVisibleRows": 8
      }
    },
    {
      "id": "n5",
      "type": "customNode",
      "position": {
        "x": 780,
        "y": 360
      },
      "size": {
        "w": 280,
        "h": 180
      },
      "data": {
        "kind": "custom",
        "icon": "ServiceLevelObjectivesIcon",
        "name": "Business SLOs",
        "mode": "slos",
        "slos": [],
        "maxVisibleRows": 8
      }
    }
  ],
  "edges": [
    {
      "id": "e1",
      "source": "n1",
      "target": "n2",
      "type": "normal",
      "direction": "forward",
      "sourceHandle": "r",
      "targetHandle": "l"
    },
    {
      "id": "e2",
      "source": "n1",
      "target": "n3",
      "type": "normal",
      "direction": "forward",
      "sourceHandle": "r",
      "targetHandle": "l"
    },
    {
      "id": "e3",
      "source": "n2",
      "target": "n4",
      "type": "kpi",
      "direction": "forward",
      "kpi": {
        "dql": "timeseries r = avg(dt.service.request.response_time, scalar: true)\n| fieldsAdd v = r / 1000\n| fields v",
        "unit": "ms",
        "decimals": 1,
        "animated": true,
        "threshold": {
          "direction": "above",
          "warning": 300,
          "failing": 800
        }
      },
      "sourceHandle": "r",
      "targetHandle": "l",
      "label": "Response time"
    },
    {
      "id": "e4",
      "source": "n3",
      "target": "n4",
      "type": "normal",
      "direction": "forward",
      "sourceHandle": "r",
      "targetHandle": "l"
    }
  ]
}
