{
  "schemaVersion": "1.0",
  "id": "91946d79-2688-4eb4-9b31-fa290d7892f9",
  "name": "Demo – Sprint tenant (datos reales)",
  "description": "Diagrama de verificación con datos que existen en hit3747h: frontend, synthetic locations, Davis events y system events",
  "owner": "system",
  "createdAt": "2026-10-04T12:49:25.601Z",
  "updatedAt": "2026-10-04T12:49:25.601Z",
  "settings": {
    "background": "dots",
    "defaultTimeframe": {
      "from": "now()-2h",
      "to": "now()"
    },
    "refreshInterval": "off"
  },
  "nodes": [
    {
      "id": "n1",
      "type": "entityNode",
      "position": {
        "x": 0,
        "y": 120
      },
      "data": {
        "kind": "entity",
        "componentType": "frontend",
        "name": "My web application",
        "entityDql": "smartscapeNodes \"FRONTEND\"\n| fields id, id_classic, name",
        "icon": "ApplicationsIcon",
        "failPoint": {
          "warningMin": 1,
          "failingMin": 2
        },
        "kpi": {
          "enabled": true,
          "title": "Eventos por tipo (timeframe)",
          "maxRows": 5,
          "dql": "fetch events\n| summarize eventos = count(), by: {event.kind}\n| sort eventos desc\n| limit 5"
        }
      }
    },
    {
      "id": "n2",
      "type": "customNode",
      "position": {
        "x": 420,
        "y": 0
      },
      "size": {
        "w": 300,
        "h": 260
      },
      "data": {
        "kind": "custom",
        "icon": "WorldmapIcon",
        "name": "Synthetic locations",
        "mode": "entities",
        "entities": {
          "dql": "smartscapeNodes \"SYNTHETIC_LOCATION\"\n| fields id, name\n| sort name asc\n| limit 12",
          "subNameField": "name",
          "criterion": "anyProblem"
        },
        "maxVisibleRows": 7
      }
    },
    {
      "id": "n3",
      "type": "customNode",
      "position": {
        "x": 420,
        "y": 340
      },
      "size": {
        "w": 300,
        "h": 130
      },
      "data": {
        "kind": "custom",
        "icon": "ApplicationsIcon",
        "name": "Frontend (contenedor de 1 entidad)",
        "mode": "entities",
        "entities": {
          "dql": "smartscapeNodes \"FRONTEND\"\n| fields id, id_classic, name",
          "subNameField": "name",
          "criterion": "anyProblem"
        },
        "maxVisibleRows": 8
      }
    }
  ],
  "edges": [
    {
      "id": "e1",
      "source": "n1",
      "target": "n2",
      "sourceHandle": "r",
      "targetHandle": "l",
      "type": "kpi",
      "direction": "forward",
      "label": "Davis events",
      "kpi": {
        "dql": "fetch events\n| summarize v = count()",
        "unit": "eventos",
        "decimals": 0,
        "animated": true,
        "threshold": {
          "direction": "above",
          "warning": 1000,
          "failing": 5000
        }
      }
    },
    {
      "id": "e2",
      "source": "n1",
      "target": "n3",
      "sourceHandle": "r",
      "targetHandle": "l",
      "type": "kpi",
      "direction": "backward",
      "label": "System events",
      "kpi": {
        "dql": "fetch dt.system.events\n| summarize v = count()",
        "unit": "eventos",
        "decimals": 0,
        "animated": true,
        "threshold": {
          "direction": "above",
          "warning": 500,
          "failing": 1000
        }
      }
    },
    {
      "id": "e3",
      "source": "n2",
      "target": "n3",
      "sourceHandle": "b",
      "targetHandle": "t",
      "type": "kpi",
      "direction": "none",
      "label": "Davis events (umbral bajo)",
      "kpi": {
        "dql": "fetch events\n| summarize v = count()",
        "unit": "eventos",
        "decimals": 0,
        "animated": true,
        "threshold": {
          "direction": "above",
          "warning": 300,
          "failing": 1000
        }
      }
    }
  ]
}
